{
  "page": 5,
  "content_types": ["sections"],
  "fulltitle": null,
  "other_info": null,
  "table_of_contents": null,
  "may_be_last_page_semantics_text": null,
  "sections": [
    {
      "title": "前言",
      "pages": [5],
      "children": [
        {
          "title": "起草依据",
          "pages": [5],
          "text": "本标准按照GB/T 1.1—2009给出的规则起草。"
        },
        {
          "title": "代替说明与主要技术变化",
          "pages": [5],
          "text": "本标准代替GB/T 35273-2017《信息安全技术 个人信息安全规范》，与GB/T 35273-2017相比，主要技术变化如下：",
          "children": [
            { "title": "增加了“多项业务功能的自主选择”（见5.3）", "pages": [5] },
            { "title": "修改了“征得授权同意的例外”（见5.6，2017年版的5.4）", "pages": [5] },
            { "title": "增加了“用户画像的使用限制”（见7.4）", "pages": [5] },
            { "title": "增加了“个性化展示的使用”（见7.5）", "pages": [5] },
            { "title": "增加了“基于不同业务目所收集个人信息的汇聚融合”（见7.6）", "pages": [5] },
            { "title": "修改了“个人信息主体注销账户”（见8.5，2017年版的7.8）", "pages": [5] },
            { "title": "增加了“第三方接入管理”（见9.7）", "pages": [5] },
            { "title": "修改了“明确责任部门与人员”（见11.1，2017年版的10.1）", "pages": [5] },
            { "title": "增加了“个人信息安全工程”（见11.2）", "pages": [5] },
            { "title": "增加了“个人信息处理活动记录”（见11.3）", "pages": [5] },
            { "title": "修改了“实现个人信息主体自主意愿的方法”（见附录C，2017年版的附录C）", "pages": [5] }
          ]
        },
        {
          "title": "专利声明",
          "pages": [5],
          "text": "请注意本文件的某些内容可能涉及专利。本文件的发布机构不承担识别这些专利的责任。"
        },
        {
          "title": "归口单位",
          "pages": [5],
          "text": "本标准由全国信息安全标准化技术委员会（SAC/TC260）提出并归口。"
        },
        {
          "title": "起草单位",
          "pages": [5],
          "text": "中国电子技术标准化研究院、北京信息安全测评中心、颐信科技有限公司、四川大学、清华大学、中国信息通信研究院、公安部第一研究所、中国网络安全审查技术与认证中心、深圳腾讯计算机系统有限公司、上海国际问题研究院、阿里巴巴（北京）软件服务有限公司、中电长城网际系统应用有限公司、阿里云计算有限公司、华为技术有限公司、强韵数据科技有限公司。"
        },
        {
          "title": "主要起草人",
          "pages": [5],
          "text": "洪延青、何延哲、杨建军、钱秀槟、陈兴蜀、刘贤刚、上官晓丽、高林、邵正强、金涛、胡影、赵冉冉、韩煜、陈湉、高磊、张晓梅、张志强、葛鑫、周晨炜、秦小伟、邵华、蔡晓丹、黄晓林、顾伟、黄劲、李媛、许静慧、赵章界、孔耀晖、范红、杜跃进、杨思磊、张亚男、叶晓俊、郑斌、闵京华、鲁传颖、周亚超、杨露、王海舟、王建民、秦颂、姚相振、葛小宇、王道奎、沈锡镛。"
        },
        {
          "title": "历次版本",
          "pages": [5],
          "text": "本标准所代替标准的历次版本发布情况为：",
          "children": [
            { "title": "GB/T 35273-2017", "pages": [5] }
          ]
        }
      ]
    }
  ]
}
