{
  "page": 8,
  "content_types": [
    "sections"
  ],
  "fulltitle": null,
  "other_info": null,
  "table_of_contents": null,
  "may_be_last_page_semantics_text": null,
  "sections": [
    {
      "title": "3.3",
      "pages": [
        8
      ],
      "text": "个人信息主体 personal information subject\n个人信息所标识或者关联的自然人。"
    },
    {
      "title": "3.4",
      "pages": [
        8
      ],
      "text": "个人信息控制者 personal information controller\n有能力决定个人信息处理目的、方式等的组织或个人。"
    },
    {
      "title": "3.5",
      "pages": [
        8
      ],
      "text": "收集 collect\n获得个人信息的控制权的行为。\n注1：包括由个人信息主体主动提供、通过与个人信息主体交互或记录个人信息主体行为等自动采集行为，以及通过共享、转让、搜集公开信息等间接获取个人信息等行为。\n注2：如果产品或服务的提供者提供工具供个人信息主体使用，提供者不对个人信息进行访问的，则不属于本标准所称的收集。例如，离线导航软件在终端获取个人信息主体位置信息后，如果不回传至软件提供者，则不属于个人信息主体位置信息的收集。"
    },
    {
      "title": "3.6",
      "pages": [
        8
      ],
      "text": "明示同意 explicit consent\n个人信息主体通过书面、口头等方式主动作出纸质或电子形式的声明，或者自主作出肯定性动作，对其个人信息进行特定处理作出明确授权的行为。"
    },
    {
      "title": "3.7",
      "pages": [
        8
      ],
      "text": "授权同意 consent\n个人信息主体对其个人信息进行特定处理作出明确授权的行为。\n注：包括通过积极的行为作出授权（即明示同意），或者通过消极的不作为而作出授权（如信息采集区域内的个人信息主体在被告知信息收集行为后没有离开该区域）。"
    },
    {
      "title": "3.8",
      "pages": [
        8
      ],
      "text": "用户画像 user profiling\n通过收集、汇聚、分析个人信息，对某特定自然人个人特征，如职业、经济、健康、\n注：直接使用特定自然人的个人信息，形成该自然人的特征模型，称为直接用户画像。使用来源于特定自然人以外的个人信息，如其所在群体的数据，形成该自然人的特征模型，称为间接用户画像。"
    },
    {
      "title": "3.9",
      "pages": [
        8
      ],
      "text": "个人信息安全影响评估 personal information security impact assessment\n成损害的各种风险，以及评估用于保护个人信息主体的各项措施有效性的过程。"
    }
  ]
}