{
  "page": 6,
  "content_types": [
    "sections"
  ],
  "fulltitle": null,
  "other_info": null,
  "table_of_contents": null,
  "may_be_last_page_semantics_text": null,
  "sections": [
    {
      "title": "前言",
      "pages": [
        6
      ],
      "text": "近年，随着信息技术的快速发展和互联网应用的普及，越来越多的组织大量收集、使用个人信息，给人们生活带来便利的同时，也出现了对个人信息的非法收集、滥用、泄露等问题，个人信息安全面临严重威胁。\n本标准针对个人信息面临的安全问题，根据《中华人民共和国网络安全法》等相关法律，规范个人信息控制者在收集、存储、使用、共享、转让、公开披露等信息处理环节中的相关行为，旨在遏制个人信息非法收集、滥用、泄漏等乱象，最大程度地保障个人的合法权益和社会公共利益。\n对标准中的具体事项，法律法规另有规定的，需遵照其规定执行。"
    }
  ]
}