{
  "page": 7,
  "content_types": [
    "sections"
  ],
  "fulltitle": null,
  "other_info": null,
  "table_of_contents": null,
  "may_be_last_page_semantics_text": null,
  "sections": [
    {
      "title": "1 范围",
      "pages": [
        7
      ],
      "text": "1 范围\n本标准规定了开展收集、存储、使用、共享、转让、公开披露、删除等个人信息处\n理活动应遵循的原则和安全要求。\n本标准适用于规范各类组织的个人信息处理活动，也适用于主管监管部门、第三方\n评估机构等组织对个人信息处理活动进行监督、管理和评估。"
    },
    {
      "title": "2 规范性引用文件",
      "pages": [
        7
      ],
      "text": "2 规范性引用文件\n下列文件对于本文件的应用是必不可少的。凡是注日期的引用文件，仅注日期的版\n本适用于本文件。凡是不注日期的引用文件，其最新版本（包括所有的修改单）适用于\n本文件。\nGB/T 25069—2010 信息安全技术 术语"
    },
    {
      "title": "3 术语和定义",
      "pages": [
        7
      ],
      "text": "3 术语和定义\nGB/T 25069—2010界定的以及下列术语和定义适用于本文件。"
    },
    {
      "title": "3.1",
      "pages": [
        7
      ],
      "text": "3.1\n个人信息 personal information\n以电子或者其他方式记录的能够单独或者与其他信息结合识别特定自然人身份或\n者反映特定自然人活动情况的各种信息。\n注1：个人信息包括姓名、出生日期、身份证件号码、个人生物识别信息、住址、通信通讯联系方式、\n通信记录和内容、账号密码、财产信息、征信信息、行踪轨迹、住宿信息、健康生理信息、交\n如何识别个人信息？\n易信息等。\n注2：关于个人信息的判定方法和类型参见附录A。"
    },
    {
      "title": "3.2",
      "pages": [
        7
      ],
      "text": "3.2\n个人敏感信息 personal sensitive information\n一旦泄露、非法提供或滥用可能危害人身和财产安全，极易导致个人名誉、身心健\n注1：个人敏感信息包括身份证件号码、个人生物识别信息、银行账户、通信记录和内容、财产信息、\n征信信息、行踪轨迹、住宿信息、健康生理信息、交易信息、14 岁以下（含）儿童的个人信息\n等。\n注2：关于个人敏感信息的判定方法和类型参见附录B。\n注3：个人信息控制者通过个人信息或其他信息加工处理后形成的信息，如一旦泄露、非法提供或滥\n个人信息控制者通过个人信息或其他信息加工处理后形成的信息，例如，用户画像或特征标签，\n能够单独或者与其他信息结合识别特定自然人身份或者反映特定自然人活动情况的，属于个人"
    }
  ]
}